{"events":[{"id":"WorkerBHandleTaskTeamLeader","initiator":"WorkerB","action":"HandleTask","receivers":["TeamLeader"]},{"id":"TeamLeaderGiveTasksWorkerAWorkerBWorkerC","initiator":"TeamLeader","action":"GiveTasks","receivers":["WorkerA","WorkerB","WorkerC"]},{"id":"WorkerCHandleJobTeamLeader","initiator":"WorkerC","action":"HandleJob","receivers":["TeamLeader"]},{"id":"WorkerAHandleTaskTeamLeaderWorkerB","initiator":"WorkerA","action":"HandleTask","receivers":["TeamLeader","WorkerB"]},{"id":"ManagementPrioritizeWorkerAWorkerAWorkerB","initiator":"Management","action":"PrioritizeWorkerA","receivers":["WorkerA","WorkerB"]},{"id":"WorkerCCallSickTeamLeader","initiator":"WorkerC","action":"CallSick","receivers":["TeamLeader"]}],"nestings":[],"relationships":[{"from":"ManagementPrioritizeWorkerAWorkerAWorkerB","to":"WorkerAHandleTaskTeamLeaderWorkerB","relations":[{"relationType":"Response"}]},{"from":"WorkerAHandleTaskTeamLeaderWorkerB","to":"WorkerBHandleTaskTeamLeader","relations":[{"relationType":"Milestone"}]},{"from":"TeamLeaderGiveTasksWorkerAWorkerBWorkerC","to":"WorkerBHandleTaskTeamLeader","relations":[{"relationType":"Condition"}]},{"from":"TeamLeaderGiveTasksWorkerAWorkerBWorkerC","to":"WorkerCHandleJobTeamLeader","relations":[{"relationType":"Condition"}]},{"from":"WorkerCCallSickTeamLeader","to":"WorkerCHandleJobTeamLeader","relations":[{"relationType":"Exclusion"}]},{"from":"TeamLeaderGiveTasksWorkerAWorkerBWorkerC","to":"WorkerAHandleTaskTeamLeaderWorkerB","relations":[{"relationType":"Condition"}]}],"markings":[{"eventId":"WorkerBHandleTaskTeamLeader","marking":{"executed":false,"included":true,"pending":false}},{"eventId":"TeamLeaderGiveTasksWorkerAWorkerBWorkerC","marking":{"executed":false,"included":true,"pending":false}},{"eventId":"WorkerCHandleJobTeamLeader","marking":{"executed":false,"included":true,"pending":false}},{"eventId":"WorkerAHandleTaskTeamLeaderWorkerB","marking":{"executed":false,"included":true,"pending":false}},{"eventId":"ManagementPrioritizeWorkerAWorkerAWorkerB","marking":{"executed":false,"included":true,"pending":false}},{"eventId":"WorkerCCallSickTeamLeader","marking":{"executed":false,"included":true,"pending":false}}]}