{
  "events": [
    {
      "id": "AAction1B",
      "initiator": "A",
      "action": "Action1",
      "receivers": ["B"]
    }
  ],
  "nestings": [],
  "relationships": [
    {
      "from": "AAction1B",
      "to": "AAction1B",
      "relations": [{ "relationType": "Exclusion" }]
    }
  ],
  "markings": [
    {
      "eventId": "AAction1B",
      "marking": { "executed": false, "included": true, "pending": false }
    }
  ]
}
