{
  "events": [
    {
      "id": "B2A",
      "initiator": "B",
      "action": "2",
      "receivers": [ "A", "C" ]
    },
    {
      "id": "C3B",
      "initiator": "C",
      "action": "3",
      "receivers": [ "B", "A" ]
    },
    {
      "id": "A1B",
      "initiator": "A",
      "action": "1",
      "receivers": [ "B", "C" ]
    }
  ],
  "nestings": [],
  "relationships": [
    {
      "from": "C3B",
      "to": "C3B",
      "relations": [ { "relationType": "Exclusion" } ]
    },
    {
      "from": "C3B",
      "to": "B2A",
      "relations": [ { "relationType": "Exclusion" } ]
    },
    {
      "from": "B2A",
      "to": "A1B",
      "relations": [ { "relationType": "Exclusion" } ]
    },
    {
      "from": "A1B",
      "to": "A1B",
      "relations": [ { "relationType": "Condition" } ]
    }
  ],
  "markings": [
    {
      "eventId": "B2A",
      "marking": {
        "executed": false,
        "included": true,
        "pending": false
      }
    },
    {
      "eventId": "C3B",
      "marking": {
        "executed": false,
        "included": true,
        "pending": true
      }
    },
    {
      "eventId": "A1B",
      "marking": {
        "executed": false,
        "included": true,
        "pending": true
      }
    }
  ]
}
