{
    "events": [
        {
            "id": "ePResponsee",
            "initiator": "eP",
            "action": "Response",
            "receivers": [
                "e"
            ]
        },
        {
            "id": "eNullNull",
            "initiator": "e",
            "action": "Null",
            "receivers": [
                "Null"
            ]
        }
    ],
    "nestings": [],
    "relationships": [
        {
            "from": "ePResponsee",
            "to": "eNullNull",
            "relations": [
                {
                    "relationType": "Response"
                }
            ]
        }
    ],
    "markings": [
        {
            "eventId": "ePResponsee",
            "marking": {
                "executed": false,
                "included": true,
                "pending": false
            }
        },
        {
            "eventId": "eNullNull",
            "marking": {
                "executed": false,
                "included": true,
                "pending": false
            }
        }
    ]
}