{"events":[{"id":"R1AR2","initiator":"R1","action":"A","receivers":["R2"]},{"id":"R3A2R4","initiator":"R3","action":"A2","receivers":["R4"]}],"nestings":[{"id":"Nesting1","events":["R1AR2","R3A2R4"],"childNestings":[]}],"relationships":[],"markings":[{"eventId":"R1AR2","marking":{"executed":false,"included":true,"pending":false}},{"eventId":"R3A2R4","marking":{"executed":false,"included":true,"pending":false}}]}