{"events":[{"id":"RoleA64a59094RoleB","initiator":"RoleA","action":"64a59094","receivers":["RoleB"]},{"id":"RoleA57aa8121RoleB","initiator":"RoleA","action":"57aa8121","receivers":["RoleB"]},{"id":"RoleB5f383aa5RoleC","initiator":"RoleB","action":"5f383aa5","receivers":["RoleC"]},{"id":"RoleB2f76a7d0RoleC","initiator":"RoleB","action":"2f76a7d0","receivers":["RoleC"]}],"nestings":[],"relationships":[{"from":"RoleA64a59094RoleB","to":"RoleB5f383aa5RoleC","relations":[{"relationType":"Exclusion"}]},{"from":"RoleA64a59094RoleB","to":"RoleB5f383aa5RoleC","relations":[{"relationType":"Milestone"}]},{"from":"RoleA57aa8121RoleB","to":"RoleB5f383aa5RoleC","relations":[{"relationType":"Inclusion"}]},{"from":"RoleA57aa8121RoleB","to":"RoleB5f383aa5RoleC","relations":[{"relationType":"Exclusion"}]},{"from":"RoleB5f383aa5RoleC","to":"RoleB2f76a7d0RoleC","relations":[{"relationType":"Condition"}]},{"from":"RoleB5f383aa5RoleC","to":"RoleB2f76a7d0RoleC","relations":[{"relationType":"Milestone"}]}],"markings":[]}