{"events":[{"id":"WorkerBHandleTaskTeamLeader","initiator":"WorkerB","action":"HandleTask","receivers":["TeamLeader"]},{"id":"TeamLeaderGiveTasksWorkerAWorkerBWorkerC","initiator":"TeamLeader","action":"GiveTasks","receivers":["WorkerA","WorkerB","WorkerC"]},{"id":"WorkerCHandleJobTeamLeader","initiator":"WorkerC","action":"HandleJob","receivers":["TeamLeader"]},{"id":"WorkerAHandleTaskTeamLeader","initiator":"WorkerA","action":"HandleTask","receivers":["TeamLeader"]},{"id":"ManagementPrioritizeWorkerAWorkerA","initiator":"Management","action":"PrioritizeWorkerA","receivers":["WorkerA"]},{"id":"WorkerCCallSickTeamLeader","initiator":"WorkerC","action":"CallSick","receivers":["TeamLeader"]}],"nestings":[],"relationships":[{"from":"ManagementPrioritizeWorkerAWorkerA","to":"WorkerAHandleTaskTeamLeader","relations":[{"relationType":"Response"}]},{"from":"TeamLeaderGiveTasksWorkerAWorkerBWorkerC","to":"WorkerAHandleTaskTeamLeader","relations":[{"relationType":"Condition"}]},{"from":"TeamLeaderGiveTasksWorkerAWorkerBWorkerC","to":"WorkerBHandleTaskTeamLeader","relations":[{"relationType":"Condition"}]},{"from":"TeamLeaderGiveTasksWorkerAWorkerBWorkerC","to":"WorkerCHandleJobTeamLeader","relations":[{"relationType":"Condition"}]},{"from":"WorkerCCallSickTeamLeader","to":"WorkerCHandleJobTeamLeader","relations":[{"relationType":"Exclusion"}]},{"from":"WorkerAHandleTaskTeamLeader","to":"WorkerBHandleTaskTeamLeader","relations":[{"relationType":"Milestone"}]}],"markings":[{"eventId":"WorkerBHandleTaskTeamLeader","marking":{"executed":false,"included":true,"pending":false}},{"eventId":"TeamLeaderGiveTasksWorkerAWorkerBWorkerC","marking":{"executed":false,"included":true,"pending":false}},{"eventId":"WorkerCHandleJobTeamLeader","marking":{"executed":false,"included":true,"pending":false}},{"eventId":"WorkerAHandleTaskTeamLeader","marking":{"executed":false,"included":true,"pending":false}},{"eventId":"ManagementPrioritizeWorkerAWorkerA","marking":{"executed":false,"included":true,"pending":false}},{"eventId":"WorkerCCallSickTeamLeader","marking":{"executed":false,"included":true,"pending":false}}]}